<?xml version="1.0" encoding="UTF-8"?>
<!ELEMENT bookstore (book+)>
<!ELEMENT book (title, author, genre)>
<!ELEMENT title (#PCDATA)>
<!ELEMENT author (#PCDATA)>
<!ELEMENT genre (#PCDATA)>
<!ATTLIST book id CDATA #REQUIRED>
